{
  "$schema": "https://json-schema.org/draft/2020-12/schema",
  "$id": "https://eidetic-engine/schemas/ee.test_event.v1.json",
  "title": "ee.test_event.v1",
  "description": "Structured test event emitted by the J1 logging harness. Both the Rust harness in src/obs/test_log.rs and the bash harness in scripts/lib/e2e_logger.sh produce events matching this schema, written one-per-line to the path in EE_TEST_LOG_PATH. Bead bd-17c65.10.1.",
  "type": "object",
  "required": ["schema", "ts", "test_id", "kind"],
  "additionalProperties": false,
  "properties": {
    "schema": {
      "type": "string",
      "const": "ee.test_event.v1"
    },
    "ts": {
      "type": "string",
      "format": "date-time",
      "description": "RFC 3339 timestamp with sub-second precision."
    },
    "test_id": {
      "type": "string",
      "description": "Stable identifier for the test (typically test name + parameter hash). Used to filter events across a multi-test run."
    },
    "kind": {
      "type": "string",
      "enum": [
        "command_start",
        "command_end",
        "assert_ok",
        "assert_fail",
        "golden_compare",
        "timer_lap",
        "note",
        "pack_hash_components",
        "db_generation_observed",
        "volatile_strip",
        "schema_gate",
        "field_selector",
        "bench_iteration",
        "artifact_manifest",
        "lint_determinism",
        "proptest_run",
        "redaction_apply"
      ]
    },
    "command": {
      "type": "string",
      "description": "argv[0] of the command being recorded. Optional; mainly populated by CommandRecorder."
    },
    "args": {
      "type": "array",
      "items": { "type": "string" }
    },
    "stdin_hash": {
      "type": "string",
      "pattern": "^(blake3:[0-9a-f]{64}|sha256:[0-9a-f]{64})$",
      "description": "BLAKE3 hash of the stdin bytes piped to the command. We hash rather than log bytes so the log never carries secret content."
    },
    "stdout_hash": {
      "type": "string",
      "pattern": "^(blake3:[0-9a-f]{64}|sha256:[0-9a-f]{64})$"
    },
    "stderr_hash": {
      "type": "string",
      "pattern": "^(blake3:[0-9a-f]{64}|sha256:[0-9a-f]{64})$"
    },
    "stderr_excerpt": {
      "type": "string",
      "description": "First N bytes of stderr (default cap 4096) as a lossy UTF-8 string. Diagnostic excerpt only."
    },
    "exit_code": {
      "type": "integer"
    },
    "elapsed_ms": {
      "type": "number",
      "minimum": 0
    },
    "fields": {
      "type": "object",
      "description": "Free-form per-test fields (label, expected/actual for asserts, blob_size, ...). Schema-flexible by design.",
      "additionalProperties": true
    }
  },
  "allOf": [
    {
      "if": { "properties": { "kind": { "const": "assert_ok" } } },
      "then": {
        "properties": {
          "fields": {
            "type": "object",
            "required": ["label"]
          }
        }
      }
    },
    {
      "if": { "properties": { "kind": { "const": "assert_fail" } } },
      "then": {
        "properties": {
          "fields": {
            "type": "object",
            "required": ["label", "expected", "actual"]
          }
        }
      }
    },
    {
      "if": { "properties": { "kind": { "const": "pack_hash_components" } } },
      "then": {
        "properties": {
          "fields": {
            "type": "object",
            "required": [
              "pack_request_hash",
              "draft_items_hash",
              "degraded_summary_hash",
              "rendered_text_hash",
              "composite_hash"
            ]
          }
        }
      }
    },
    {
      "if": { "properties": { "kind": { "const": "db_generation_observed" } } },
      "then": {
        "properties": {
          "fields": {
            "type": "object",
            "required": ["command", "health", "db_generation", "index_generation"]
          }
        }
      }
    },
    {
      "if": { "properties": { "kind": { "const": "volatile_strip" } } },
      "then": {
        "properties": {
          "fields": {
            "type": "object",
            "required": ["fields_stripped_count", "fields_stripped", "input_bytes", "output_bytes"]
          }
        }
      }
    },
    {
      "if": { "properties": { "kind": { "const": "schema_gate" } } },
      "then": {
        "properties": {
          "fields": {
            "type": "object",
            "required": [
              "target_schema",
              "log_lines_checked",
              "kinds_observed",
              "orphans_in_schema",
              "orphans_in_src"
            ]
          }
        }
      }
    },
    {
      "if": { "properties": { "kind": { "const": "field_selector" } } },
      "then": {
        "properties": {
          "fields": {
            "type": "object",
            "required": [
              "surface",
              "preset",
              "explicit_fields_count",
              "fields_in_response",
              "rejected_field_count",
              "elapsed_us"
            ]
          }
        }
      }
    },
    {
      "if": { "properties": { "kind": { "const": "bench_iteration" } } },
      "then": {
        "properties": {
          "fields": {
            "type": "object",
            "required": ["operation", "status", "profile", "workload_tier"]
          }
        }
      }
    },
    {
      "if": { "properties": { "kind": { "const": "artifact_manifest" } } },
      "then": {
        "properties": {
          "fields": {
            "type": "object",
            "properties": {
              "manifest_schema": {
                "type": "string",
                "enum": ["ee.test_artifact_manifest.v1", "ee.test_artifact_manifest.v2"]
              },
              "phase": { "type": "string", "minLength": 1 },
              "binary_path": { "type": "string" },
              "binary_hash": { "type": "string" },
              "binary_hash_status": { "type": "string" },
              "source_hash": { "type": "string" },
              "command_hash": {
                "type": "string",
                "pattern": "^(blake3:[0-9a-f]{64}|sha256:[0-9a-f]{64})$"
              },
              "command_arg_count": { "type": "string", "pattern": "^[0-9]+$" },
              "execution_substrate": { "type": "string", "minLength": 1 }
            },
            "required": [
              "manifest_schema",
              "phase",
              "binary_path",
              "binary_hash",
              "binary_hash_status",
              "source_hash",
              "command_hash",
              "command_arg_count",
              "execution_substrate",
              "local_host",
              "worker_host",
              "target_directory",
              "fixture_filter",
              "log_path",
              "retention_manifest_path",
              "artifact_manifest_hash"
            ]
          }
        }
      }
    },
    {
      "if": {
        "required": ["kind", "fields"],
        "properties": {
          "kind": { "const": "artifact_manifest" },
          "fields": {
            "type": "object",
            "required": ["manifest_schema"],
            "properties": {
              "manifest_schema": { "const": "ee.test_artifact_manifest.v2" }
            }
          }
        }
      },
      "then": {
        "properties": {
          "fields": {
            "type": "object",
            "required": [
              "remote_artifact_attestation",
              "source_commit",
              "git_tree",
              "artifact_manifest_hash",
              "binary_hash",
              "build_command_hash",
              "effective_input_hash",
              "provenance_hash",
              "archive_hash",
              "verification_hash"
            ],
            "properties": {
              "phase": { "const": "command_end" },
              "binary_path": { "type": "string", "minLength": 1 },
              "binary_hash": { "type": "string", "pattern": "^sha256:[0-9a-f]{64}$" },
              "binary_hash_status": { "const": "available" },
              "source_hash": { "type": "string", "pattern": "^git_tree:[0-9a-f]{40}$" },
              "command_hash": {
                "type": "string",
                "pattern": "^(blake3:[0-9a-f]{64}|sha256:[0-9a-f]{64})$"
              },
              "command_arg_count": { "type": "string", "pattern": "^[1-9][0-9]*$" },
              "execution_substrate": { "const": "remote_artifact" },
              "artifact_manifest_hash": { "type": "string", "pattern": "^sha256:[0-9a-f]{64}$" },
              "source_commit": { "type": "string", "pattern": "^[0-9a-f]{40}$" },
              "git_tree": { "type": "string", "pattern": "^[0-9a-f]{40}$" },
              "build_command_hash": { "type": "string", "pattern": "^sha256:[0-9a-f]{64}$" },
              "effective_input_hash": { "type": "string", "pattern": "^sha256:[0-9a-f]{64}$" },
              "provenance_hash": { "type": "string", "pattern": "^sha256:[0-9a-f]{64}$" },
              "archive_hash": { "type": "string", "pattern": "^sha256:[0-9a-f]{64}$" },
              "verification_hash": { "type": "string", "pattern": "^sha256:[0-9a-f]{64}$" },
              "remote_artifact_attestation": {
                "$ref": "ee.remote_build_artifact_manifest.verification.v1.json"
              }
            }
          }
        }
      }
    },
    {
      "if": { "properties": { "kind": { "const": "lint_determinism" } } },
      "then": {
        "properties": {
          "fields": {
            "type": "object",
            "required": [
              "disallowed_methods_violations",
              "exemptions_count",
              "exemptions_with_justification",
              "ui_tests_passed",
              "ui_tests_failed"
            ]
          }
        }
      }
    },
    {
      "if": { "properties": { "kind": { "const": "proptest_run" } } },
      "then": {
        "properties": {
          "fields": {
            "type": "object",
            "required": [
              "axes_count",
              "cases_sampled",
              "cases_passed",
              "cases_failed",
              "new_regressions",
              "stale_regressions_flagged",
              "elapsed_seconds",
              "budget_seconds"
            ]
          }
        }
      }
    },
    {
      "if": { "properties": { "kind": { "const": "redaction_apply" } } },
      "then": {
        "properties": {
          "fields": {
            "type": "object",
            "required": [
              "level",
              "surface",
              "fields_redacted_count",
              "patterns_matched",
              "tokens_truncated",
              "content_hash_original",
              "audit_row_id"
            ]
          }
        }
      }
    }
  ]
}
